topic,advice,link
Bullying,"If you're being harassed online, block the user and report them immediately.","https://www.stopbullying.gov"
Hate Speech,"Hateful content can be reported directly to platforms. Here's how to report on Twitter.","https://help.twitter.com/en/safety-and-security/report-abusive-behavior"
Misinformation,"Check facts before sharing. Use verified sources like Snopes or FactCheck.org.","https://www.factcheck.org"
Mental Health,"You're not alone. Reach out to support organizations like Mental Health America.","https://mhanational.org"
Privacy,"Protect your personal information. Never share sensitive details publicly.","https://www.privacy.gov"
Scams,"Be cautious of suspicious links and requests for personal information.","https://www.consumer.ftc.gov/articles/how-avoid-phishing-scams"
Academic Pressure,"It's okay to seek help with schoolwork. Talk to teachers or counselors.","https://www.samhsa.gov/find-help/national-helpline"
Body Image,"Everyone is unique and valuable. Focus on health, not appearance standards.","https://www.nationaleatingdisorders.org"